ts_code,symbol,name,area,industry,fullname,enname,cnspell,market,exchange,curr_type,list_status,list_date,delist_date,is_hs
600857.SH,600857,宁波中百,浙江,百货,宁波中百股份有限公司,"Ningbo Zhongbai Co., Ltd",nbzb,主板,SSE,CNY,L,19940425,,N
600858.SH,600858,银座股份,山东,百货,银座集团股份有限公司,"Inzone Group Co.,Ltd",yzgf,主板,SSE,CNY,L,19940506,,N
600859.SH,600859,王府井,北京,百货,王府井集团股份有限公司,"Wangfujing Group Co., Ltd.",wfj,主板,SSE,CNY,L,19940506,,H
600860.SH,600860,京城股份,北京,专用机械,北京京城机电股份有限公司,Beijing Jingcheng Machinery Electric Company Limited,jcgf,主板,SSE,CNY,L,19940506,,H
600861.SH,600861,北京城乡,北京,百货,北京城乡商业(集团)股份有限公司,"Beijing Urban-Rural Commercial (Group) Co., Ltd.",bjcx,主板,SSE,CNY,L,19940520,,N
600862.SH,600862,中航高科,江苏,航空,中航航空高科技股份有限公司,"Avic Aviation High-Technology Co.,Ltd.",zhgk,主板,SSE,CNY,L,19940520,,H
600863.SH,600863,内蒙华电,内蒙,火力发电,内蒙古蒙电华能热电股份有限公司,Inner Mongolia Mengdian Huaneng Thermal Power Corporation Limited,nmhd,主板,SSE,CNY,L,19940520,,H
600864.SH,600864,哈投股份,黑龙江,证券,哈尔滨哈投投资股份有限公司,"Harbin Hatou Investment Co.,Ltd",htgf,主板,SSE,CNY,L,19940809,,N
600865.SH,600865,百大集团,浙江,百货,百大集团股份有限公司,"Baida Group Co.,Ltd.",bdjt,主板,SSE,CNY,L,19940809,,N
600866.SH,600866,星湖科技,广东,食品,广东肇庆星湖生物科技股份有限公司,"STAR LAKE Bioscience Co.,Inc Zhaoqing Guangdong",xhkj,主板,SSE,CNY,L,19940818,,N
600867.SH,600867,通化东宝,吉林,生物制药,通化东宝药业股份有限公司,"Tonghua Dongbao Pharmaceutical Co.,Ltd.",thdb,主板,SSE,CNY,L,19940824,,H
600868.SH,600868,梅雁吉祥,广东,水力发电,广东梅雁吉祥水电股份有限公司,"Guangdong Meiyan Jixiang Hydropower Co.,Ltd.",myjx,主板,SSE,CNY,L,19940912,,N
600869.SH,600869,远东股份,青海,电气设备,远东智慧能源股份有限公司,"Far East Smarter Energy Co.,Ltd",ydgf,主板,SSE,CNY,L,19950206,,N
600870.SH,600870,*ST厦华,福建,家用电器,厦门华侨电子股份有限公司,"Xiamen Overseas Chinese Electronic Co.,Ltd.",stxh,主板,SSE,CNY,L,19950228,,N
600871.SH,600871,石化油服,北京,石油开采,中石化石油工程技术服务股份有限公司,Sinopec Oilfield Service Corporation,shyf,主板,SSE,CNY,L,19950411,,H
600872.SH,600872,中炬高新,广东,食品,中炬高新技术实业(集团)股份有限公司,"Jonjee Hi-Tech Industrial and Commercial Holding Co.,Ltd",zjgx,主板,SSE,CNY,L,19950124,,H
600873.SH,600873,梅花生物,西藏,食品,梅花生物科技集团股份有限公司,"Meihua Holdings Group Co.,Ltd",mhsw,主板,SSE,CNY,L,19950217,,N
600874.SH,600874,创业环保,天津,环境保护,天津创业环保集团股份有限公司,Tianjin Capital Environmental Protection Group Company Limited,cyhb,主板,SSE,CNY,L,19950630,,H
600875.SH,600875,东方电气,四川,电气设备,东方电气股份有限公司,Dongfang Electric Corporation Limited,dfdq,主板,SSE,CNY,L,19951010,,H
600876.SH,600876,洛阳玻璃,河南,玻璃,洛阳玻璃股份有限公司,Luoyang Glass Company Limited,lybl,主板,SSE,CNY,L,19951031,,H
600877.SH,600877,电能股份,重庆,电气设备,中电科能源股份有限公司,"Cetc Energy Joint-Stock Co.,Ltd.",dngf,主板,SSE,CNY,L,19951013,,N
600879.SH,600879,航天电子,湖北,航空,航天时代电子技术股份有限公司,"China Aerospace Times Electronics Co.,Ltd.",htdz,主板,SSE,CNY,L,19951115,,H
600880.SH,600880,博瑞传播,四川,广告包装,成都博瑞传播股份有限公司,"Chengdu B-Ray Media Co.,Ltd.",brcb,主板,SSE,CNY,L,19951115,,N
600881.SH,600881,亚泰集团,吉林,水泥,吉林亚泰(集团)股份有限公司,"Jilin Yatai (Group) Co.,Ltd.",ytjt,主板,SSE,CNY,L,19951115,,N
600882.SH,600882,妙可蓝多,上海,乳制品,上海妙可蓝多食品科技股份有限公司,"Shanghai Milkground Food Tech Co., Ltd.",mkld,主板,SSE,CNY,L,19951206,,N
600883.SH,600883,博闻科技,云南,水泥,云南博闻科技实业股份有限公司,"Yunnan Bowin Technology Industry Co.,Ltd",bwkj,主板,SSE,CNY,L,19951208,,N
600884.SH,600884,杉杉股份,浙江,综合类,宁波杉杉股份有限公司,"Ningbo Shanshan Co.,Ltd.",ssgf,主板,SSE,CNY,L,19960130,,N
600885.SH,600885,宏发股份,湖北,电气设备,宏发科技股份有限公司,"Hongfa Technology Co., Ltd.",hfgf,主板,SSE,CNY,L,19960205,,H
600886.SH,600886,国投电力,北京,水力发电,国投电力控股股份有限公司,"SDIC Power Holdings Co.,Ltd.",gtdl,主板,SSE,CNY,L,19960118,,H
600887.SH,600887,伊利股份,内蒙,乳制品,内蒙古伊利实业集团股份有限公司,"Inner Mongolia Yili Industrial Group Co.,Ltd.",ylgf,主板,SSE,CNY,L,19960312,,H
600888.SH,600888,新疆众和,新疆,铝,新疆众和股份有限公司,"Xinjiang Joinworld Co.,Ltd.",xjzh,主板,SSE,CNY,L,19960215,,N
600889.SH,600889,南京化纤,江苏,化纤,南京化纤股份有限公司,"Nanjing Chemical Fibre Co.,Ltd",njhx,主板,SSE,CNY,L,19960308,,N
600890.SH,600890,*ST中房,北京,区域地产,中房置业股份有限公司,"CRED Holding Co.,Ltd",stzf,主板,SSE,CNY,L,19960318,,N
600892.SH,600892,大晟文化,深圳,影视音像,大晟时代文化投资股份有限公司,"Dasheng Times Cultural Investment Co.,Ltd.",dswh,主板,SSE,CNY,L,19960315,,N
600893.SH,600893,航发动力,陕西,航空,中国航发动力股份有限公司,"Aecc Aviation Power Co,Ltd",hfdl,主板,SSE,CNY,L,19960408,,H
600894.SH,600894,广日股份,广东,运输设备,广州广日股份有限公司,"Guangzhou Guangri Stock Co., Ltd.",grgf,主板,SSE,CNY,L,19960328,,N
600895.SH,600895,张江高科,上海,园区开发,上海张江高科技园区开发股份有限公司,"Shanghai Zhangjiang Hi-Tech Park Development Co.,Ltd",zjgk,主板,SSE,CNY,L,19960422,,H
600896.SH,600896,*ST海医,海南,医疗保健,览海医疗产业投资股份有限公司,"Lanhai Medical Investment Co.,Ltd.",sthy,主板,SSE,CNY,L,19960503,,N
600897.SH,600897,厦门空港,福建,机场,元翔(厦门)国际航空港股份有限公司,"Xiamen International Airport Co., Ltd",xmkg,主板,SSE,CNY,L,19960531,,N
600898.SH,600898,ST美讯,山东,通信设备,国美通讯设备股份有限公司,"Gome Telecom Equipment Co., Ltd.",stmx,主板,SSE,CNY,L,19960418,,N
600900.SH,600900,长江电力,北京,水力发电,中国长江电力股份有限公司,"China Yangtze Power Co., Ltd.",cjdl,主板,SSE,CNY,L,20031118,,H
600901.SH,600901,江苏租赁,江苏,多元金融,江苏金融租赁股份有限公司,"Jiangsu Financial Leasing Co., Ltd.",jszl,主板,SSE,CNY,L,20180301,,N
600903.SH,600903,贵州燃气,贵州,供气供热,贵州燃气集团股份有限公司,Guizhou Gas Group Corporation Ltd.,gzrq,主板,SSE,CNY,L,20171107,,H
600905.SH,600905,三峡能源,北京,新型电力,中国三峡新能源(集团)股份有限公司,"China Three Gorges Renewables (Group) Co.,Ltd.",sxny,主板,SSE,CNY,L,20210610,,N
600906.SH,600906,财达证券,河北,证券,财达证券股份有限公司,"Caida Securities Co.,Ltd",cdzq,主板,SSE,CNY,L,20210507,,N
600908.SH,600908,无锡银行,江苏,银行,无锡农村商业银行股份有限公司,"Wuxi Rural Commercial Bank Co.,Ltd",wxyh,主板,SSE,CNY,L,20160923,,N
600909.SH,600909,华安证券,安徽,证券,华安证券股份有限公司,"Huaan Securities Co.,Ltd.",hazq,主板,SSE,CNY,L,20161206,,H
600916.SH,600916,中国黄金,北京,黄金,中国黄金集团黄金珠宝股份有限公司,"China National Gold Group Gold Jewellery Co.,Ltd",zghj,主板,SSE,CNY,L,20210205,,N
600917.SH,600917,重庆燃气,重庆,供气供热,重庆燃气集团股份有限公司,Chongqing Gas Group Corporation Ltd.,cqrq,主板,SSE,CNY,L,20140930,,H
600918.SH,600918,中泰证券,山东,证券,中泰证券股份有限公司,"Zhongtai Securities Co., Ltd.",ztzq,主板,SSE,CNY,L,20200603,,H
600919.SH,600919,江苏银行,江苏,银行,江苏银行股份有限公司,"Bank of Jiangsu Co.,Ltd.",jsyh,主板,SSE,CNY,L,20160802,,H
600926.SH,600926,杭州银行,浙江,银行,杭州银行股份有限公司,"Bank of Hangzhou Co., Ltd.",hzyh,主板,SSE,CNY,L,20161027,,H
600928.SH,600928,西安银行,陕西,银行,西安银行股份有限公司,"Bank of Xi'an Co.,Ltd.",xayh,主板,SSE,CNY,L,20190301,,N
600929.SH,600929,雪天盐业,湖南,食品,雪天盐业集团股份有限公司,"Snowsky Salt Industry Group CO.,LTD",xtyy,主板,SSE,CNY,L,20180326,,N
600933.SH,600933,爱柯迪,浙江,汽车配件,爱柯迪股份有限公司,"Ikd Co., Ltd.",akd,主板,SSE,CNY,L,20171117,,H
600936.SH,600936,广西广电,广西,影视音像,广西广播电视信息网络股份有限公司,Guangxi Radio and Television Information Network Corporation Limited,gxgd,主板,SSE,CNY,L,20160815,,N
600939.SH,600939,重庆建工,重庆,建筑工程,重庆建工集团股份有限公司,"Chongqing Construction Engineering Group Co.,Ltd",cqjg,主板,SSE,CNY,L,20170221,,N
600956.SH,600956,新天绿能,河北,供气供热,新天绿色能源股份有限公司,China Suntien Green Energy Corporation Limited,xtln,主板,SSE,CNY,L,20200629,,H
600958.SH,600958,东方证券,上海,证券,东方证券股份有限公司,Orient Securities Company Limited,dfzq,主板,SSE,CNY,L,20150323,,H
600959.SH,600959,江苏有线,江苏,影视音像,江苏省广电有线信息网络股份有限公司,Jiangsu Broadcasting Cable Information Network Corporation Limited,jsyx,主板,SSE,CNY,L,20150428,,N
600960.SH,600960,渤海汽车,山东,汽车配件,渤海汽车系统股份有限公司,"Bohai Automotive Systems CO.,LTD.",bhqc,主板,SSE,CNY,L,20040407,,N
600961.SH,600961,株冶集团,湖南,铅锌,株洲冶炼集团股份有限公司,"Zhuzhou Smelter Group Co.,Ltd.",zyjt,主板,SSE,CNY,L,20040830,,N
600962.SH,600962,国投中鲁,北京,软饮料,国投中鲁果汁股份有限公司,"SDIC Zhonglu Fruit Juice Co., Ltd.",gtzl,主板,SSE,CNY,L,20040622,,N
600963.SH,600963,岳阳林纸,湖南,造纸,岳阳林纸股份有限公司,"Yueyang Forest & Paper Co., Ltd.",yylz,主板,SSE,CNY,L,20040525,,N
600965.SH,600965,福成股份,河北,农业综合,河北福成五丰食品股份有限公司,"Fortune Ng Fung Food (Hebei) Co.,Ltd",fcgf,主板,SSE,CNY,L,20040713,,N
600966.SH,600966,博汇纸业,山东,造纸,山东博汇纸业股份有限公司,"Shandong Bohui Paper Industry Co.,Ltd.",bhzy,主板,SSE,CNY,L,20040608,,H
600967.SH,600967,内蒙一机,内蒙,运输设备,内蒙古第一机械集团股份有限公司,"Inner Mongolia First Machinery GroupCo.,Ltd.",nmyj,主板,SSE,CNY,L,20040518,,H
600968.SH,600968,海油发展,北京,石油开采,中海油能源发展股份有限公司,Cnooc Energy Technology & Services Limited,hyfz,主板,SSE,CNY,L,20190626,,H
600969.SH,600969,郴电国际,湖南,水力发电,湖南郴电国际发展股份有限公司,"Hunan Chendian International Developmentco.,ltd",cdgj,主板,SSE,CNY,L,20040408,,N
600970.SH,600970,中材国际,江苏,建筑工程,中国中材国际工程股份有限公司,"Sinoma International Engineering Co.,Ltd",zcgj,主板,SSE,CNY,L,20050412,,H
600971.SH,600971,恒源煤电,安徽,煤炭开采,安徽恒源煤电股份有限公司,"Anhui Hengyuan Coal Industry and Electricity Power Co.,Ltd",hymd,主板,SSE,CNY,L,20040817,,H
600973.SH,600973,宝胜股份,江苏,电气设备,宝胜科技创新股份有限公司,"Baosheng Science and Technology Innovation Co.,Ltd.",bsgf,主板,SSE,CNY,L,20040802,,N
600975.SH,600975,新五丰,湖南,农业综合,湖南新五丰股份有限公司,"Hunan New Wellful Co.,Ltd.",xwf,主板,SSE,CNY,L,20040609,,H
600976.SH,600976,健民集团,湖北,中成药,健民药业集团股份有限公司,"Jianmin Pharmaceutical Group Co., Ltd.",jmjt,主板,SSE,CNY,L,20040419,,N
600977.SH,600977,中国电影,北京,影视音像,中国电影股份有限公司,"China Film Co.,Ltd.",zgdy,主板,SSE,CNY,L,20160809,,N
600979.SH,600979,广安爱众,四川,水力发电,四川广安爱众股份有限公司,"Sichuan Guangan AAA Public Co., Ltd",gaaz,主板,SSE,CNY,L,20040906,,N
600980.SH,600980,北矿科技,北京,元器件,北矿科技股份有限公司,"BGRIMM Technology Co., Ltd.",bkkj,主板,SSE,CNY,L,20040512,,N
600981.SH,600981,汇鸿集团,江苏,商贸代理,江苏汇鸿国际集团股份有限公司,Jiangsu High Hope International Group Corporation,hhjt,主板,SSE,CNY,L,20040630,,N
600982.SH,600982,宁波能源,浙江,供气供热,宁波能源集团股份有限公司,"Ningbo Energy Group Co.,Ltd.",nbny,主板,SSE,CNY,L,20040706,,N
600983.SH,600983,惠而浦,安徽,家用电器,惠而浦(中国)股份有限公司,"Whirlpool (China) Co., Ltd.",hep,主板,SSE,CNY,L,20040727,,N
600984.SH,600984,建设机械,陕西,工程机械,陕西建设机械股份有限公司,"Shaanxi Construction Machinery Co.,Ltd",jsjx,主板,SSE,CNY,L,20040707,,H
600985.SH,600985,淮北矿业,安徽,煤炭开采,淮北矿业控股股份有限公司,"Huaibei Mining Holdings Co.,Ltd.",hbky,主板,SSE,CNY,L,20040428,,H
600986.SH,600986,浙文互联,山东,互联网,浙文互联集团股份有限公司,"Zhewen Interactive Group Co., Ltd.",zwhl,主板,SSE,CNY,L,20040426,,N
600987.SH,600987,航民股份,浙江,纺织,浙江航民股份有限公司,"Zhejiang Hangmin Co.,Ltd",hmgf,主板,SSE,CNY,L,20040809,,N
600988.SH,600988,赤峰黄金,内蒙,黄金,赤峰吉隆黄金矿业股份有限公司,"Chifeng Jilong Gold Mining Co.,Ltd.",cfhj,主板,SSE,CNY,L,20040414,,H
600989.SH,600989,宝丰能源,宁夏,化工原料,宁夏宝丰能源集团股份有限公司,"Ningxia Baofeng Energy Group Co.,Ltd.",bfny,主板,SSE,CNY,L,20190516,,H
600990.SH,600990,四创电子,安徽,通信设备,四创电子股份有限公司,"Sun-Create Electronics Co.,Ltd",scdz,主板,SSE,CNY,L,20040510,,N
600992.SH,600992,贵绳股份,贵州,钢加工,贵州钢绳股份有限公司,"Guizhou Wire Rope Co., Ltd",gsgf,主板,SSE,CNY,L,20040514,,N
600993.SH,600993,马应龙,湖北,中成药,马应龙药业集团股份有限公司,"Mayinglong Pharmaceutical Group Co.,Ltd",myl,主板,SSE,CNY,L,20040517,,H
600995.SH,600995,文山电力,云南,水力发电,云南文山电力股份有限公司,"Yunnan Wenshan Electric Power Co.,Ltd.",wsdl,主板,SSE,CNY,L,20040615,,N
600996.SH,600996,贵广网络,贵州,影视音像,贵州省广播电视信息网络股份有限公司,"Guizhou BC&TV Information Network CO.,LTD",ggwl,主板,SSE,CNY,L,20161226,,N
600997.SH,600997,开滦股份,河北,煤炭开采,开滦能源化工股份有限公司,"Kailuan Energy Chemical Co.,Ltd.",klgf,主板,SSE,CNY,L,20040602,,N
600998.SH,600998,九州通,湖北,医药商业,九州通医药集团股份有限公司,"Jointown Pharmaceutical Group Co., Ltd",jzt,主板,SSE,CNY,L,20101102,,H
600999.SH,600999,招商证券,深圳,证券,招商证券股份有限公司,"China Merchants Securities Co., Ltd",zszq,主板,SSE,CNY,L,20091117,,H
601000.SH,601000,唐山港,河北,港口,唐山港集团股份有限公司,"Tangshan Port Group Co.,Ltd.",tsg,主板,SSE,CNY,L,20100705,,H
601001.SH,601001,晋控煤业,山西,煤炭开采,晋能控股山西煤业股份有限公司,"Jinneng Holding Shanxi Coal Industry Co.,Ltd",jkmy,主板,SSE,CNY,L,20060623,,N
601002.SH,601002,晋亿实业,浙江,机械基件,晋亿实业股份有限公司,"Gem-Year Industrial Co.,Ltd.",jysy,主板,SSE,CNY,L,20070126,,N
601003.SH,601003,柳钢股份,广西,普钢,柳州钢铁股份有限公司,"Liuzhou Iron & Steel Co.,Ltd.",lggf,主板,SSE,CNY,L,20070227,,H
601005.SH,601005,重庆钢铁,重庆,普钢,重庆钢铁股份有限公司,Chongqing Iron & Steel Company Limited,cqgt,主板,SSE,CNY,L,20070228,,H
601006.SH,601006,大秦铁路,山西,铁路,大秦铁路股份有限公司,"Daqin Railway Co., Ltd.",dqtl,主板,SSE,CNY,L,20060801,,N
601007.SH,601007,金陵饭店,江苏,酒店餐饮,金陵饭店股份有限公司,"Jinling Hotel Corporation, Ltd.",jlfd,主板,SSE,CNY,L,20070406,,N
601008.SH,601008,连云港,江苏,港口,江苏连云港港口股份有限公司,"Jiangsu Lianyungang Port Co.,Ltd.",lyg,主板,SSE,CNY,L,20070426,,N
601009.SH,601009,南京银行,江苏,银行,南京银行股份有限公司,"Bank of Nanjing Co.,Ltd.",njyh,主板,SSE,CNY,L,20070719,,H
601010.SH,601010,文峰股份,江苏,超市连锁,文峰大世界连锁发展股份有限公司,Wenfeng Great World Chain Development Corporation,wfgf,主板,SSE,CNY,L,20110603,,N
601011.SH,601011,宝泰隆,黑龙江,焦炭加工,宝泰隆新材料股份有限公司,"Baotailong New Materials Co.,Ltd",btl,主板,SSE,CNY,L,20110309,,N
601012.SH,601012,隆基股份,陕西,电气设备,隆基绿能科技股份有限公司,"Longi Green Energy Technology Co., Ltd.",ljgf,主板,SSE,CNY,L,20120411,,H
601015.SH,601015,陕西黑猫,陕西,焦炭加工,陕西黑猫焦化股份有限公司,"Shaanxi Heimao Coking Co., Ltd.",sxhm,主板,SSE,CNY,L,20141105,,N
601016.SH,601016,节能风电,北京,新型电力,中节能风力发电股份有限公司,CECEP Wind-Power Corporation,jnfd,主板,SSE,CNY,L,20140929,,H
601018.SH,601018,宁波港,浙江,港口,宁波舟山港股份有限公司,Ningbo Zhoushan Port Company Limited,nbg,主板,SSE,CNY,L,20100928,,H
601019.SH,601019,山东出版,山东,出版业,山东出版传媒股份有限公司,"Shandong Publishing & Media Co.,Ltd",sdcb,主板,SSE,CNY,L,20171122,,H
601020.SH,601020,ST华钰,西藏,铅锌,西藏华钰矿业股份有限公司,"Tibet Huayu Mining Co.,Ltd.",sthy,主板,SSE,CNY,L,20160316,,N
601021.SH,601021,春秋航空,上海,空运,春秋航空股份有限公司,"Spring Airlines Co., Ltd.",cqhk,主板,SSE,CNY,L,20150121,,H
601028.SH,601028,玉龙股份,江苏,商贸代理,山东玉龙黄金股份有限公司,"Shandong Yulong Gold Co., Ltd.",ylgf,主板,SSE,CNY,L,20111107,,N
601038.SH,601038,一拖股份,河南,农用机械,第一拖拉机股份有限公司,First Tractor Company Limited,ytgf,主板,SSE,CNY,L,20120808,,H
601058.SH,601058,赛轮轮胎,山东,汽车配件,赛轮集团股份有限公司,"Sailun Group Co.,Ltd.",sllt,主板,SSE,CNY,L,20110630,,H
601066.SH,601066,中信建投,北京,证券,中信建投证券股份有限公司,"China Securities Co.,Ltd.",zxjt,主板,SSE,CNY,L,20180620,,H
601068.SH,601068,中铝国际,北京,建筑工程,中铝国际工程股份有限公司,China Aluminum International Engineering Corporation Limited,zlgj,主板,SSE,CNY,L,20180831,,H
601069.SH,601069,西部黄金,新疆,黄金,西部黄金股份有限公司,"Western Region Gold Co.,Ltd",xbhj,主板,SSE,CNY,L,20150122,,H
601077.SH,601077,渝农商行,重庆,银行,重庆农村商业银行股份有限公司,"Chongqing Rural Commercial Bank Co.,Ltd.",ynsh,主板,SSE,CNY,L,20191029,,H
601086.SH,601086,国芳集团,甘肃,百货,甘肃国芳工贸(集团)股份有限公司,Gansu Guofang Industry & Trade Group Limited by Share Ltd.,gfjt,主板,SSE,CNY,L,20170929,,N
601088.SH,601088,中国神华,北京,煤炭开采,中国神华能源股份有限公司,China Shenhua Energy Company Limited,zgsh,主板,SSE,CNY,L,20071009,,H
601098.SH,601098,中南传媒,湖南,出版业,中南出版传媒集团股份有限公司,"China South Publishing & Media Group Co., Ltd",zncm,主板,SSE,CNY,L,20101028,,H
601099.SH,601099,太平洋,云南,证券,太平洋证券股份有限公司,"The Pacific Securities Co.,Ltd.",tpy,主板,SSE,CNY,L,20071228,,H
601100.SH,601100,恒立液压,江苏,工程机械,江苏恒立液压股份有限公司,"Jiangsu Hengli  Hydraulic  CO.,Ltd.",hlyy,主板,SSE,CNY,L,20111028,,H
601101.SH,601101,昊华能源,北京,煤炭开采,北京昊华能源股份有限公司,"Beijing Haohua Energy Resource Co.,Ltd.",hhny,主板,SSE,CNY,L,20100331,,N
601106.SH,601106,中国一重,黑龙江,工程机械,中国第一重型机械股份公司,China First Heavy Industries,zgyz,主板,SSE,CNY,L,20100209,,N
601107.SH,601107,四川成渝,四川,路桥,四川成渝高速公路股份有限公司,Sichuan Expressway Company Limited,sccy,主板,SSE,CNY,L,20090727,,H
601108.SH,601108,财通证券,浙江,证券,财通证券股份有限公司,"Caitong Securities Co.,Ltd.",ctzq,主板,SSE,CNY,L,20171024,,H
601111.SH,601111,中国国航,北京,空运,中国国际航空股份有限公司,Air China Limited,zggh,主板,SSE,CNY,L,20060818,,H
601113.SH,601113,ST华鼎,浙江,化纤,义乌华鼎锦纶股份有限公司,"Yiwu Huading Nylon Co.,Ltd.",sthd,主板,SSE,CNY,L,20110509,,N
601116.SH,601116,三江购物,浙江,超市连锁,三江购物俱乐部股份有限公司,"Sanjiang Shopping Club Co.,Ltd",sjgw,主板,SSE,CNY,L,20110302,,N
601117.SH,601117,中国化学,北京,建筑工程,中国化学工程股份有限公司,"China National Chemical Engineering Co., Ltd.",zghx,主板,SSE,CNY,L,20100107,,H
601118.SH,601118,海南橡胶,海南,橡胶,海南天然橡胶产业集团股份有限公司,"China Hainan Rubber Industry Group Co., Ltd.",hnxj,主板,SSE,CNY,L,20110107,,N
601126.SH,601126,四方股份,北京,电气设备,北京四方继保自动化股份有限公司,"Beijing Sifang Automation Co.,Ltd",sfgf,主板,SSE,CNY,L,20101231,,N
601127.SH,601127,小康股份,重庆,汽车配件,重庆小康工业集团股份有限公司,"Chongqing Sokon Industry Group Stock Co.,Ltd.",xkgf,主板,SSE,CNY,L,20160615,,N
601128.SH,601128,常熟银行,江苏,银行,江苏常熟农村商业银行股份有限公司,"Jiangsu Changshu Rural Commercial Bank Co.,Ltd.",csyh,主板,SSE,CNY,L,20160930,,H
601137.SH,601137,博威合金,浙江,铜,宁波博威合金材料股份有限公司,Ningbo Boway Alloy Material Company Limited,bwhj,主板,SSE,CNY,L,20110127,,N
601138.SH,601138,工业富联,深圳,通信设备,富士康工业互联网股份有限公司,"Foxconn Industrial Internet Co.,Ltd.",gyfl,主板,SSE,CNY,L,20180608,,H
601139.SH,601139,深圳燃气,深圳,供气供热,深圳市燃气集团股份有限公司,Shenzhen Gas Corporation Ltd.,szrq,主板,SSE,CNY,L,20091225,,H
601155.SH,601155,新城控股,江苏,区域地产,新城控股集团股份有限公司,"Seazen Holdings Co.,Ltd",xckg,主板,SSE,CNY,L,20151204,,H
601156.SH,601156,东航物流,上海,空运,东方航空物流股份有限公司,"Eastern Air Logistics Co., Ltd.",dhwl,主板,SSE,CNY,L,20210609,,N
601158.SH,601158,重庆水务,重庆,水务,重庆水务集团股份有限公司,"Chongqing Water Group Co.,Ltd.",cqsw,主板,SSE,CNY,L,20100329,,H
601162.SH,601162,天风证券,湖北,证券,天风证券股份有限公司,"Tianfeng Securities Co.,Ltd",tfzq,主板,SSE,CNY,L,20181019,,H
601163.SH,601163,三角轮胎,山东,汽车配件,三角轮胎股份有限公司,"Triangle Tyre Co.,Ltd",sjlt,主板,SSE,CNY,L,20160909,,N
601166.SH,601166,兴业银行,福建,银行,兴业银行股份有限公司,"Industrial Bank Co.,Ltd.",xyyh,主板,SSE,CNY,L,20070205,,H
601168.SH,601168,西部矿业,青海,铜,西部矿业股份有限公司,"Western Mining Co.,Ltd.",xbky,主板,SSE,CNY,L,20070712,,N
601169.SH,601169,北京银行,北京,银行,北京银行股份有限公司,"Bank of Beijing Co., Ltd.",bjyh,主板,SSE,CNY,L,20070919,,H
601177.SH,601177,杭齿前进,浙江,机械基件,杭州前进齿轮箱集团股份有限公司,"Hangzhou Advance Gearbox Group Co., Ltd.",hcqj,主板,SSE,CNY,L,20101011,,N
601179.SH,601179,中国西电,陕西,电气设备,中国西电电气股份有限公司,"China XD Electric Co.,Ltd",zgxd,主板,SSE,CNY,L,20100128,,N
601186.SH,601186,中国铁建,北京,建筑工程,中国铁建股份有限公司,China Railway Construction Corporation Limited,zgtj,主板,SSE,CNY,L,20080310,,H
601187.SH,601187,厦门银行,福建,银行,厦门银行股份有限公司,"Xiamen Bank Co.,Ltd",xmyh,主板,SSE,CNY,L,20201027,,H
601188.SH,601188,龙江交通,黑龙江,路桥,黑龙江交通发展股份有限公司,"Heilongjiang Transport Development Co.,Ltd",ljjt,主板,SSE,CNY,L,20100319,,N
601198.SH,601198,东兴证券,北京,证券,东兴证券股份有限公司,Dongxing Securities Company Limited,dxzq,主板,SSE,CNY,L,20150226,,H
601199.SH,601199,江南水务,江苏,水务,江苏江南水务股份有限公司,"Jiangsu Jiangnan Water Co.,Ltd.",jnsw,主板,SSE,CNY,L,20110317,,N
601200.SH,601200,上海环境,上海,环境保护,上海环境集团股份有限公司,"Shanghai Environment Group Co., Ltd.",shhj,主板,SSE,CNY,L,20170331,,H
601208.SH,601208,东材科技,四川,化工原料,四川东材科技集团股份有限公司,"Sichuan Em Technology Co.,Ltd.",dckj,主板,SSE,CNY,L,20110520,,N
601211.SH,601211,国泰君安,上海,证券,国泰君安证券股份有限公司,"Guotai Junan Securities Co., Ltd.",gtja,主板,SSE,CNY,L,20150626,,H
601212.SH,601212,白银有色,甘肃,铜,白银有色集团股份有限公司,"Baiyin Nonferrous Group Co., Ltd.",byys,主板,SSE,CNY,L,20170215,,N
601216.SH,601216,君正集团,内蒙,化工原料,内蒙古君正能源化工集团股份有限公司,"Inner Mongolia Junzheng Energy & Chemical Group Co.,Ltd.",jzjt,主板,SSE,CNY,L,20110222,,H
601218.SH,601218,吉鑫科技,江苏,机械基件,江苏吉鑫风能科技股份有限公司,"Jiangsu SINOJIT Wind Energy Technology Co., Ltd.",jxkj,主板,SSE,CNY,L,20110506,,N
601222.SH,601222,林洋能源,江苏,电器仪表,江苏林洋能源股份有限公司,"Jiangsu Linyang Energy Co., Ltd.",lyny,主板,SSE,CNY,L,20110808,,H
601225.SH,601225,陕西煤业,陕西,煤炭开采,陕西煤业股份有限公司,Shaanxi Coal Industry Company Limited,sxmy,主板,SSE,CNY,L,20140128,,H
601226.SH,601226,华电重工,北京,专用机械,华电重工股份有限公司,"Huadian Heavy Industries Co., Ltd.",hdzg,主板,SSE,CNY,L,20141211,,N
601228.SH,601228,广州港,广东,港口,广州港股份有限公司,Guangzhou Port Company Limited,gzg,主板,SSE,CNY,L,20170329,,N
601229.SH,601229,上海银行,上海,银行,上海银行股份有限公司,"Bank of Shanghai Co., Ltd.",shyh,主板,SSE,CNY,L,20161116,,H
