ts_code,symbol,name,area,industry,fullname,enname,cnspell,market,exchange,curr_type,list_status,list_date,delist_date,is_hs
002675.SZ,002675,东诚药业,山东,化学制药,烟台东诚药业集团股份有限公司,"Yantai Dongcheng Biochemicals Co.,Ltd",dcyy,中小板,SZSE,CNY,L,20120525,,S
002676.SZ,002676,顺威股份,广东,塑料,广东顺威精密塑料股份有限公司,"Guangdong Sunwill Precising Plastic Co.,Ltd.",swgf,中小板,SZSE,CNY,L,20120525,,N
002677.SZ,002677,浙江美大,浙江,家用电器,浙江美大实业股份有限公司,"Zhejiang Meida Industrial Co.,Ltd.",zjmd,中小板,SZSE,CNY,L,20120525,,S
002678.SZ,002678,珠江钢琴,广东,文教休闲,广州珠江钢琴集团股份有限公司,"Guangzhou Pearl River Piano Group Co.,Ltd",zjgq,中小板,SZSE,CNY,L,20120530,,N
002679.SZ,002679,福建金森,福建,林业,福建金森林业股份有限公司,"Fujian Jinsen Forestry Co., Ltd.",fjjs,中小板,SZSE,CNY,L,20120605,,N
002681.SZ,002681,奋达科技,深圳,家用电器,深圳市奋达科技股份有限公司,"Shenzhen Fenda Technology Co., Ltd.",fdkj,中小板,SZSE,CNY,L,20120605,,N
002682.SZ,002682,龙洲股份,福建,公路,龙洲集团股份有限公司,"Longzhou Group Co.,Ltd.",lzgf,中小板,SZSE,CNY,L,20120612,,N
002683.SZ,002683,宏大爆破,广东,化工原料,广东宏大爆破股份有限公司,"Guangdong Hongda Blasting Co.,Ltd",hdbp,中小板,SZSE,CNY,L,20120612,,S
002684.SZ,002684,*ST猛狮,河南,电气设备,猛狮新能源科技(河南)股份有限公司,"Dynavolt Renewable Energy Technology (Henan) Co., Ltd.",stms,中小板,SZSE,CNY,L,20120612,,N
002685.SZ,002685,华东重机,江苏,工程机械,无锡华东重型机械股份有限公司,"Wuxi Huadong Heavy Machinery Co., Ltd.",hdzj,中小板,SZSE,CNY,L,20120612,,N
002686.SZ,002686,亿利达,浙江,专用机械,浙江亿利达风机股份有限公司,"Zhejiang Yilida Ventilator Co.,Ltd.",yld,中小板,SZSE,CNY,L,20120703,,N
002687.SZ,002687,乔治白,浙江,服饰,浙江乔治白服饰股份有限公司,"Zhejiang Giuseppe Garment Co., Ltd",qzb,中小板,SZSE,CNY,L,20120713,,N
002688.SZ,002688,金河生物,内蒙,化学制药,金河生物科技股份有限公司,"Jinhe Biotechnology CO.,LTD.",jhsw,中小板,SZSE,CNY,L,20120713,,N
002689.SZ,002689,远大智能,辽宁,运输设备,沈阳远大智能工业集团股份有限公司,"Shenyang Yuanda Intellectual Industry Group Co.,Ltd",ydzn,中小板,SZSE,CNY,L,20120717,,N
002690.SZ,002690,美亚光电,安徽,专用机械,合肥美亚光电技术股份有限公司,Hefei Meyer Optoelectronic Technology Inc.,mygd,中小板,SZSE,CNY,L,20120731,,S
002691.SZ,002691,冀凯股份,河北,专用机械,冀凯装备制造股份有限公司,"Jikai Equipment Manufacturing Co., Ltd.",jkgf,中小板,SZSE,CNY,L,20120731,,N
002692.SZ,002692,ST远程,江苏,电气设备,远程电缆股份有限公司,"Yuan Cheng Cable Co.,Ltd.",styc,中小板,SZSE,CNY,L,20120808,,N
002693.SZ,002693,双成药业,海南,化学制药,海南双成药业股份有限公司,"Hainan Shuangcheng Pharmaceuticals Co., Ltd.",scyy,中小板,SZSE,CNY,L,20120808,,N
002694.SZ,002694,顾地科技,湖北,塑料,顾地科技股份有限公司,"Goody Science & Technology Co.,Ltd.",gdkj,中小板,SZSE,CNY,L,20120816,,N
002695.SZ,002695,煌上煌,江西,食品,江西煌上煌集团食品股份有限公司,"Jiangxi Huangshanghuang Group Food Co., Ltd.",hsh,中小板,SZSE,CNY,L,20120905,,S
002696.SZ,002696,百洋股份,广西,渔业,百洋产业投资集团股份有限公司,"Baiyang Investment Group,Inc.",bygf,中小板,SZSE,CNY,L,20120905,,N
002697.SZ,002697,红旗连锁,四川,超市连锁,成都红旗连锁股份有限公司,"Chengdu Hongqi Chain Co., Ltd.",hqls,中小板,SZSE,CNY,L,20120905,,S
002698.SZ,002698,博实股份,黑龙江,化工机械,哈尔滨博实自动化股份有限公司,"Harbin Boshi Automation Co., Ltd.",bsgf,中小板,SZSE,CNY,L,20120911,,S
002699.SZ,002699,美盛文化,浙江,影视音像,美盛文化创意股份有限公司,"Meisheng Cultural & Creative Corp, Ltd.",mswh,中小板,SZSE,CNY,L,20120911,,N
002700.SZ,002700,ST浩源,新疆,供气供热,新疆浩源天然气股份有限公司,"Xinjiang Haoyuan Natural Gas Co.,Ltd.",sthy,中小板,SZSE,CNY,L,20120921,,N
002701.SZ,002701,奥瑞金,北京,广告包装,奥瑞金科技股份有限公司,"ORG Technology Co.,Ltd.",arj,中小板,SZSE,CNY,L,20121011,,S
002702.SZ,002702,海欣食品,福建,食品,海欣食品股份有限公司,"Haixin Foods Co.,Ltd.",hxsp,中小板,SZSE,CNY,L,20121011,,N
002703.SZ,002703,浙江世宝,浙江,汽车配件,浙江世宝股份有限公司,Zhejiang Shibao Company Limited,zjsb,中小板,SZSE,CNY,L,20121102,,S
002705.SZ,002705,新宝股份,广东,家用电器,广东新宝电器股份有限公司,"Guangdong Xinbao Electrical Appliances Holdings Co.,Ltd",xbgf,中小板,SZSE,CNY,L,20140121,,S
002706.SZ,002706,良信股份,上海,电气设备,上海良信电器股份有限公司,"Shanghai Liangxin Electrical Co.,LTD.",lxgf,中小板,SZSE,CNY,L,20140121,,S
002707.SZ,002707,众信旅游,北京,旅游服务,众信旅游集团股份有限公司,"Utour Group Co., Ltd.",zxly,中小板,SZSE,CNY,L,20140123,,N
002708.SZ,002708,光洋股份,江苏,汽车配件,常州光洋轴承股份有限公司,Changzhou Nrb Corporation,gygf,中小板,SZSE,CNY,L,20140121,,N
002709.SZ,002709,天赐材料,广东,化工原料,广州天赐高新材料股份有限公司,"Guangzhou Tinci Materials Technology Co., Ltd.",tccl,中小板,SZSE,CNY,L,20140123,,S
002712.SZ,002712,思美传媒,浙江,广告包装,思美传媒股份有限公司,"Simei Media Co.,Ltd",smcm,中小板,SZSE,CNY,L,20140123,,N
002713.SZ,002713,东易日盛,北京,装修装饰,东易日盛家居装饰集团股份有限公司,"Dong Yi Ri Sheng Home Decoration Group Co.,Ltd.",dyrs,中小板,SZSE,CNY,L,20140219,,N
002714.SZ,002714,牧原股份,河南,农业综合,牧原食品股份有限公司,"Muyuan Foods Co.,Ltd.",mygf,中小板,SZSE,CNY,L,20140128,,S
002715.SZ,002715,登云股份,广东,汽车配件,怀集登云汽配股份有限公司,"Huaiji Dengyun Auto-Parts (Holding) Co.,Ltd.",dygf,中小板,SZSE,CNY,L,20140219,,N
002716.SZ,002716,金贵银业,湖南,小金属,郴州市金贵银业股份有限公司,"Chenzhou City Jingui Silver Industry Co., Ltd",jgyy,中小板,SZSE,CNY,L,20140128,,N
002717.SZ,002717,岭南股份,广东,环境保护,岭南生态文旅股份有限公司,"Lingnan Eco&Culture-Tourism Co., Ltd.",lngf,中小板,SZSE,CNY,L,20140219,,N
002718.SZ,002718,友邦吊顶,浙江,家居用品,浙江友邦集成吊顶股份有限公司,"Zhejiang Youpon Integrated Ceiling Co., Ltd.",ybdd,中小板,SZSE,CNY,L,20140128,,N
002719.SZ,002719,*ST麦趣,新疆,乳制品,麦趣尔集团股份有限公司,"Maiquer Group Co.,Ltd",stmq,中小板,SZSE,CNY,L,20140128,,N
002721.SZ,002721,金一文化,北京,服饰,北京金一文化发展股份有限公司,"Beijing Kingee Culture Development Co.,Ltd.",jywh,中小板,SZSE,CNY,L,20140127,,N
002722.SZ,002722,金轮股份,江苏,纺织机械,金轮蓝海股份有限公司,"Geron Co., Ltd.",jlgf,中小板,SZSE,CNY,L,20140128,,N
002723.SZ,002723,金莱特,广东,家用电器,广东金莱特电器股份有限公司,"Kennede Electronics MFG. Co., Ltd.",jlt,中小板,SZSE,CNY,L,20140129,,N
002724.SZ,002724,海洋王,深圳,半导体,海洋王照明科技股份有限公司,"Ocean'S King Lighting Science & Technology Co., Ltd.",hyw,中小板,SZSE,CNY,L,20141104,,N
002725.SZ,002725,跃岭股份,浙江,汽车配件,浙江跃岭股份有限公司,"Zhejiang Yueling Co.,Ltd",ylgf,中小板,SZSE,CNY,L,20140129,,N
002726.SZ,002726,龙大肉食,山东,食品,山东龙大肉食品股份有限公司,"Shandong Longda Meat Foodstuff Co.,Ltd.",ldrs,中小板,SZSE,CNY,L,20140626,,S
002727.SZ,002727,一心堂,云南,医药商业,一心堂药业集团股份有限公司,"Yixintang Pharmaceutical Co., Ltd.",yxt,中小板,SZSE,CNY,L,20140702,,S
002728.SZ,002728,特一药业,广东,中成药,特一药业集团股份有限公司,"Teyi Pharmaceutical Group Co.,Ltd",tyyy,中小板,SZSE,CNY,L,20140731,,N
002729.SZ,002729,好利来,福建,元器件,好利来(中国)电子科技股份有限公司,"Hollyland (China) Electronics Technology Corp.,Ltd.",hll,中小板,SZSE,CNY,L,20140912,,N
002730.SZ,002730,电光科技,浙江,电气设备,电光防爆科技股份有限公司,"Dianguang Explosion-Proof Technology Co., Ltd.",dgkj,中小板,SZSE,CNY,L,20141009,,N
002731.SZ,002731,萃华珠宝,辽宁,服饰,沈阳萃华金银珠宝股份有限公司,"Shenyang Cuihua Gold and Silver Jewelry Co., Ltd.",chzb,中小板,SZSE,CNY,L,20141104,,N
002732.SZ,002732,燕塘乳业,广东,乳制品,广东燕塘乳业股份有限公司,"Guangdong Yantang Dairy Co.,Ltd.",ytry,中小板,SZSE,CNY,L,20141205,,N
002733.SZ,002733,雄韬股份,深圳,电气设备,深圳市雄韬电源科技股份有限公司,"Shenzhen Center Power Tech Co.,Ltd.",xtgf,中小板,SZSE,CNY,L,20141203,,S
002734.SZ,002734,利民股份,江苏,农药化肥,利民控股集团股份有限公司,"Limin Group Co., Ltd.",lmgf,中小板,SZSE,CNY,L,20150127,,N
002735.SZ,002735,王子新材,深圳,塑料,深圳王子新材料股份有限公司,"Shenzhen Prince New Materials Co.,Ltd.",wzxc,中小板,SZSE,CNY,L,20141203,,N
002736.SZ,002736,国信证券,深圳,证券,国信证券股份有限公司,"Guosen Securities Co.,Ltd.",gxzq,中小板,SZSE,CNY,L,20141229,,S
002737.SZ,002737,葵花药业,黑龙江,中成药,葵花药业集团股份有限公司,"Sunflower Pharmaceutical Group Co.,Ltd",khyy,中小板,SZSE,CNY,L,20141230,,S
002738.SZ,002738,中矿资源,北京,小金属,中矿资源集团股份有限公司,"Sinomine Resource Group Co., Ltd.",zkzy,中小板,SZSE,CNY,L,20141230,,S
002739.SZ,002739,万达电影,北京,影视音像,万达电影股份有限公司,"Wanda Film Holding Co., Ltd",wddy,中小板,SZSE,CNY,L,20150122,,N
002740.SZ,002740,爱迪尔,福建,服饰,福建省爱迪尔珠宝实业股份有限公司,"Fujian Ideal Jewellery Industrial Co.,Ltd",ade,中小板,SZSE,CNY,L,20150122,,N
002741.SZ,002741,光华科技,广东,化工原料,广东光华科技股份有限公司,"Guangdong Guanghua Sci-Tech Co., Ltd",ghkj,中小板,SZSE,CNY,L,20150216,,N
002742.SZ,002742,三圣股份,重庆,其他建材,重庆三圣实业股份有限公司,"Chongqing Sansheng Industrial Co.,Ltd.",ssgf,中小板,SZSE,CNY,L,20150217,,N
002743.SZ,002743,富煌钢构,安徽,钢加工,安徽富煌钢构股份有限公司,"Anhui Fuhuang Steel Structure Co.,Ltd.",fhgg,中小板,SZSE,CNY,L,20150217,,N
002745.SZ,002745,木林森,广东,电气设备,木林森股份有限公司,"MLS Co.,Ltd.",mls,中小板,SZSE,CNY,L,20150217,,S
002746.SZ,002746,仙坛股份,山东,农业综合,山东仙坛股份有限公司,"Shandong Xiantan Co.,Ltd.",xtgf,中小板,SZSE,CNY,L,20150216,,S
002747.SZ,002747,埃斯顿,江苏,机械基件,南京埃斯顿自动化股份有限公司,"Estun Automation Co.,Ltd",asd,中小板,SZSE,CNY,L,20150320,,S
002748.SZ,002748,世龙实业,江西,化工原料,江西世龙实业股份有限公司,"Jiangxi Selon Industrial Co., Ltd.",slsy,中小板,SZSE,CNY,L,20150319,,N
002749.SZ,002749,国光股份,四川,农药化肥,四川国光农化股份有限公司,"Sichuan Guoguang Agrochemical Co., Ltd.",gggf,中小板,SZSE,CNY,L,20150320,,N
002750.SZ,002750,龙津药业,云南,中成药,昆明龙津药业股份有限公司,"Kunming Longjin Pharmaceutical Co., Ltd.",ljyy,中小板,SZSE,CNY,L,20150324,,N
002751.SZ,002751,易尚展示,深圳,家居用品,深圳市易尚展示股份有限公司,"Shenzhen ESUN Display Co., Ltd.",yszs,中小板,SZSE,CNY,L,20150424,,N
002752.SZ,002752,N兴股份,福建,广告包装,N兴集团股份有限公司,Sunrise Group Company Limited,sxgf,中小板,SZSE,CNY,L,20150422,,N
002753.SZ,002753,永东股份,山西,化工原料,山西永东化工股份有限公司,"Shanxi Yongdong Chemistry Industry Co.,Ltd.",ydgf,中小板,SZSE,CNY,L,20150519,,N
002755.SZ,002755,奥赛康,北京,化学制药,北京奥赛康药业股份有限公司,"Beijing Aosaikang Pharmaceutical Co., Ltd.",ask,中小板,SZSE,CNY,L,20150515,,S
002756.SZ,002756,永兴材料,浙江,特种钢,永兴特种材料科技股份有限公司,"Yongxing Special Materials Technology Co.,Ltd",yxcl,中小板,SZSE,CNY,L,20150515,,S
002757.SZ,002757,南兴股份,广东,专用机械,南兴装备股份有限公司,"Nanxing Machinery Co., Ltd.",nxgf,中小板,SZSE,CNY,L,20150527,,N
002758.SZ,002758,浙农股份,浙江,医药商业,浙农集团股份有限公司,"ZJAMP Group Co., Ltd.",zngf,中小板,SZSE,CNY,L,20150527,,N
002759.SZ,002759,天际股份,广东,家用电器,广东天际电器股份有限公司,"Guangdong Tonze Electric Co.,Ltd.",tjgf,中小板,SZSE,CNY,L,20150528,,N
002760.SZ,002760,凤形股份,安徽,机械基件,安徽省凤形耐磨材料股份有限公司,"Anhui Fengxing Wear Resistant Materials Co.,Ltd.",fxgf,中小板,SZSE,CNY,L,20150611,,N
002761.SZ,002761,浙江建投,浙江,建筑工程,浙江省建设投资集团股份有限公司,"Zhejiang Construction Investment Group Co.,Ltd",zjjt,中小板,SZSE,CNY,L,20150610,,S
002762.SZ,002762,金发拉比,广东,服饰,金发拉比妇婴童用品股份有限公司,"Jinfa Labi Maternity & Baby Articles Co., Ltd.",jflb,中小板,SZSE,CNY,L,20150610,,N
002763.SZ,002763,汇洁股份,深圳,服饰,深圳汇洁集团股份有限公司,"Shenzhen Huijie Group Co., Ltd.",hjgf,中小板,SZSE,CNY,L,20150610,,N
002765.SZ,002765,蓝黛科技,重庆,汽车配件,蓝黛科技集团股份有限公司,"Landai Technology Group Corp., Ltd.",ldkj,中小板,SZSE,CNY,L,20150612,,N
002766.SZ,002766,*ST索菱,深圳,汽车配件,深圳市索菱实业股份有限公司,"Shenzhen Soling Industrial Co.,Ltd.",stsl,中小板,SZSE,CNY,L,20150611,,N
002767.SZ,002767,先锋电子,浙江,电器仪表,杭州先锋电子技术股份有限公司,"Hangzhou Innover Technology Co., Ltd.",xfdz,中小板,SZSE,CNY,L,20150612,,N
002768.SZ,002768,国恩股份,山东,塑料,青岛国恩科技股份有限公司,"Qingdao Gon Technology Co., Ltd.",gegf,中小板,SZSE,CNY,L,20150630,,S
002769.SZ,002769,普路通,深圳,仓储物流,深圳市普路通供应链管理股份有限公司,"Shenzhen Prolto Supply Chain Management Co., Ltd.",plt,中小板,SZSE,CNY,L,20150629,,N
002770.SZ,002770,*ST科迪,河南,乳制品,河南科迪乳业股份有限公司,"Henan Kedi Dairy Co.,Ltd.",stkd,中小板,SZSE,CNY,L,20150630,,N
002771.SZ,002771,真视通,北京,软件服务,北京真视通科技股份有限公司,Beijing Transtrue Technology Inc.,zst,中小板,SZSE,CNY,L,20150629,,N
002772.SZ,002772,众兴菌业,甘肃,种植业,天水众兴菌业科技股份有限公司,"Tianshui Zhongxing Bio-Technology Co.,Ltd.",zxjy,中小板,SZSE,CNY,L,20150626,,N
002773.SZ,002773,康弘药业,四川,化学制药,成都康弘药业集团股份有限公司,"Chengdu Kanghong Pharmaceutical Group Co., Ltd",khyy,中小板,SZSE,CNY,L,20150626,,S
002774.SZ,002774,快意电梯,广东,运输设备,快意电梯股份有限公司,"IFE Elevators Co.,Ltd.",kydt,中小板,SZSE,CNY,L,20170324,,N
002775.SZ,002775,文科园林,深圳,建筑工程,深圳文科园林股份有限公司,"Shenzhen Wenke Landscape Co.,Ltd.",wkyl,中小板,SZSE,CNY,L,20150629,,N
002776.SZ,002776,ST柏龙,广东,服饰,广东柏堡龙股份有限公司,"Guangdong Bobaolon Co.,Ltd.",stbl,中小板,SZSE,CNY,L,20150626,,N
002777.SZ,002777,久远银海,四川,软件服务,四川久远银海软件股份有限公司,"Sichuan Jiuyuan Yinhai Software Co.,Ltd",jyyh,中小板,SZSE,CNY,L,20151231,,S
002778.SZ,002778,中晟高科,江苏,石油加工,江苏中晟高科环境股份有限公司,"Jiangsu Zhongsheng Gaoke Environmental Co.,Ltd.",zsgk,中小板,SZSE,CNY,L,20160106,,N
002779.SZ,002779,中坚科技,浙江,农用机械,浙江中坚科技股份有限公司,"Zhejiang Zhongjian Technology Co ,.Ltd.",zjkj,中小板,SZSE,CNY,L,20151209,,N
002780.SZ,002780,三夫户外,北京,其他商业,北京三夫户外用品股份有限公司,"Beijing Sanfo Outdoor Products Co., Ltd",sfhw,中小板,SZSE,CNY,L,20151209,,N
002781.SZ,002781,奇信股份,深圳,装修装饰,深圳市奇信集团股份有限公司,"Shenzhen Qixin Group Co.,Ltd.",qxgf,中小板,SZSE,CNY,L,20151222,,N
002782.SZ,002782,可立克,深圳,电气设备,深圳可立克科技股份有限公司,"Shenzhen Click Technology Co., Ltd.",klk,中小板,SZSE,CNY,L,20151222,,S
002783.SZ,002783,凯龙股份,湖北,化工原料,湖北凯龙化工集团股份有限公司,"Hubei Kailong Chemical Group Co.,Ltd",klgf,中小板,SZSE,CNY,L,20151209,,N
002785.SZ,002785,万里石,福建,其他建材,厦门万里石股份有限公司,"Xiamen Wanli Stone Stock Co.,Ltd",wls,中小板,SZSE,CNY,L,20151223,,N
002786.SZ,002786,银宝山新,深圳,专用机械,深圳市银宝山新科技股份有限公司,"Shenzhen Silver Basis Technology Co.,Ltd.",ybsx,中小板,SZSE,CNY,L,20151223,,N
002787.SZ,002787,华源控股,江苏,广告包装,苏州华源控股股份有限公司,"Suzhou Hycan Holdings Co., Ltd",hykg,中小板,SZSE,CNY,L,20151231,,N
002788.SZ,002788,鹭燕医药,福建,医药商业,鹭燕医药股份有限公司,"Luyan Pharma Co.,Ltd",lyyy,中小板,SZSE,CNY,L,20160218,,N
002789.SZ,002789,建艺集团,深圳,装修装饰,深圳市建艺装饰集团股份有限公司,"Shenzhen Jianyi Decoration Group Co.,Ltd.",jyjt,中小板,SZSE,CNY,L,20160311,,N
002790.SZ,002790,瑞尔特,福建,家居用品,厦门瑞尔特卫浴科技股份有限公司,"Xiamen R&T Plumbing Technology Co., Ltd.",ret,中小板,SZSE,CNY,L,20160308,,N
002791.SZ,002791,坚朗五金,广东,其他建材,广东坚朗五金制品股份有限公司,"Guangdong Kinlong Hardware Products Co.,Ltd.",jlwj,中小板,SZSE,CNY,L,20160329,,S
002792.SZ,002792,通宇通讯,广东,通信设备,广东通宇通讯股份有限公司,Tongyu Communication Inc.,tytx,中小板,SZSE,CNY,L,20160328,,N
002793.SZ,002793,罗欣药业,浙江,化学制药,罗欣药业集团股份有限公司,"Luoxin Pharmaceuticals Group Stock Co., Ltd.",lxyy,中小板,SZSE,CNY,L,20160415,,S
002795.SZ,002795,永和智控,浙江,机械基件,永和流体智控股份有限公司,"Yorhe Fluid Intelligent Control Co., Ltd",yhzk,中小板,SZSE,CNY,L,20160428,,N
002796.SZ,002796,世嘉科技,江苏,通信设备,苏州市世嘉科技股份有限公司,Suzhou Shijia Science & Technology Inc.,sjkj,中小板,SZSE,CNY,L,20160510,,N
002797.SZ,002797,第一创业,深圳,证券,第一创业证券股份有限公司,"First Capital Securities Co.,Ltd",dycy,中小板,SZSE,CNY,L,20160511,,S
002798.SZ,002798,帝欧家居,四川,家居用品,帝欧家居股份有限公司,"D&O Home Collection Co.,Ltd",dojj,中小板,SZSE,CNY,L,20160525,,S
002799.SZ,002799,环球印务,陕西,广告包装,西安环球印务股份有限公司,"Xi'An Global Printing Co., Ltd",hqyw,中小板,SZSE,CNY,L,20160608,,N
002800.SZ,002800,天顺股份,新疆,仓储物流,新疆天顺供应链股份有限公司,"Xinjiang Tianshun Supply Chain Co.,Ltd.",tsgf,中小板,SZSE,CNY,L,20160530,,N
002801.SZ,002801,微光股份,浙江,电气设备,杭州微光电子股份有限公司,"Hangzhou Weiguang Electronic Co.,Ltd.",wggf,中小板,SZSE,CNY,L,20160622,,N
002802.SZ,002802,洪汇新材,江苏,化工原料,无锡洪汇新材料科技股份有限公司,"Wuxi Honghui New Materials Technology Co.,Ltd.",hhxc,中小板,SZSE,CNY,L,20160629,,N
002803.SZ,002803,吉宏股份,福建,互联网,厦门吉宏科技股份有限公司,"Xiamen Jihong Technology Co.,Ltd",jhgf,中小板,SZSE,CNY,L,20160712,,S
002805.SZ,002805,丰元股份,山东,化工原料,山东丰元化学股份有限公司,"Shandong Fengyuan Chemical Co.,Ltd.",fygf,中小板,SZSE,CNY,L,20160707,,N
002806.SZ,002806,华锋股份,广东,元器件,广东华锋新能源科技股份有限公司,"Guangdong Huafeng New Energy Technology Co.,Ltd.",hfgf,中小板,SZSE,CNY,L,20160726,,N
002807.SZ,002807,江阴银行,江苏,银行,江苏江阴农村商业银行股份有限公司,"Jiangsu Jiangyin Rural Commercial Bank Co.,Ltd.",jyyh,中小板,SZSE,CNY,L,20160902,,S
002808.SZ,002808,恒久科技,江苏,元器件,苏州恒久光电科技股份有限公司,Suzhou Goldengreen Technologies Ltd.,hjkj,中小板,SZSE,CNY,L,20160812,,N
002809.SZ,002809,红墙股份,广东,化工原料,广东红墙新材料股份有限公司,"Guangdong Redwall New Materials Co., Ltd.",hqgf,中小板,SZSE,CNY,L,20160823,,N
002810.SZ,002810,山东赫达,山东,化工原料,山东赫达股份有限公司,"Shandong Head Co., Ltd.",sdhd,中小板,SZSE,CNY,L,20160826,,S
002811.SZ,002811,郑中设计,深圳,装修装饰,深圳市郑中设计股份有限公司,"Shenzhen Cheng Chung Design Co.,Ltd.",zzsj,中小板,SZSE,CNY,L,20160908,,N
002812.SZ,002812,恩捷股份,云南,塑料,云南恩捷新材料股份有限公司,"Yunnan Energy New Material Co.,Ltd.",ejgf,中小板,SZSE,CNY,L,20160914,,S
002813.SZ,002813,路畅科技,深圳,汽车配件,深圳市路畅科技股份有限公司,"Shenzhen Roadrover Technology Co., Ltd.",lckj,中小板,SZSE,CNY,L,20161012,,N
002815.SZ,002815,崇达技术,深圳,元器件,崇达技术股份有限公司,"Suntak Technology Co., Ltd.",cdjs,中小板,SZSE,CNY,L,20161012,,S
002816.SZ,002816,和科达,深圳,专用机械,深圳市和科达精密清洗设备股份有限公司,"Shenzhen Hekeda Precision Cleaning Equipment Co., Ltd.",hkd,中小板,SZSE,CNY,L,20161025,,N
002817.SZ,002817,黄山胶囊,安徽,化学制药,安徽黄山胶囊股份有限公司,"Anhui Huangshan Capsule Co.,Ltd.",hsjn,中小板,SZSE,CNY,L,20161025,,N
002818.SZ,002818,富森美,四川,其他商业,成都富森美家居股份有限公司,"Chengdu Fusen Noble-House Industrial Co.,Ltd.",fsm,中小板,SZSE,CNY,L,20161109,,S
002819.SZ,002819,东方中科,北京,电器仪表,北京东方中科集成科技股份有限公司,"Beijing Oriental Jicheng  Co., Ltd.",dfzk,中小板,SZSE,CNY,L,20161111,,N
002820.SZ,002820,桂发祥,天津,食品,天津桂发祥十八街麻花食品股份有限公司,"Tianjin Guifaxiang 18th Street Mahua Food Co., Ltd.",gfx,中小板,SZSE,CNY,L,20161118,,N
002821.SZ,002821,凯莱英,天津,生物制药,凯莱英医药集团(天津)股份有限公司,"Asymchem Laboratories (Tianjin) Co., Ltd.",kly,中小板,SZSE,CNY,L,20161118,,S
002822.SZ,002822,中装建设,深圳,装修装饰,深圳市中装建设集团股份有限公司,"Shenzhen Zhongzhuang Construction Group Co.,Ltd.",zzjs,中小板,SZSE,CNY,L,20161129,,N
002823.SZ,002823,凯中精密,深圳,机械基件,深圳市凯中精密技术股份有限公司,"Shenzhen Kaizhong Precision Technology Co.,Ltd.",kzjm,中小板,SZSE,CNY,L,20161124,,N
002824.SZ,002824,和胜股份,广东,铝,广东和胜工业铝材股份有限公司,"Guangdong Hoshion Aluminium Co.,Ltd.",hsgf,中小板,SZSE,CNY,L,20170112,,N
002825.SZ,002825,纳尔股份,上海,化工原料,上海纳尔实业股份有限公司,"Shanghai Nar Industrial Co., Ltd.",negf,中小板,SZSE,CNY,L,20161129,,N
002826.SZ,002826,易明医药,西藏,中成药,西藏易明西雅医药科技股份有限公司,Tibet Aim Pharm. Inc.,ymyy,中小板,SZSE,CNY,L,20161209,,N
002827.SZ,002827,高争民爆,西藏,化工原料,西藏高争民爆股份有限公司,"Tibet Gaozheng Explosive Co., Ltd.",gzmb,中小板,SZSE,CNY,L,20161209,,N
002828.SZ,002828,贝肯能源,新疆,石油开采,新疆贝肯能源工程股份有限公司,"Xinjiang Beiken Energy Engineering Co.,Ltd.",bkny,中小板,SZSE,CNY,L,20161208,,N
002829.SZ,002829,星网宇达,北京,通信设备,北京星网宇达科技股份有限公司,"BeiJing StarNeto Technology Co.,Ltd.",xwyd,中小板,SZSE,CNY,L,20161213,,N
002830.SZ,002830,名雕股份,深圳,装修装饰,深圳市名雕装饰股份有限公司,"Shenzhen Mingdiao Decoration Co., Ltd.",mdgf,中小板,SZSE,CNY,L,20161213,,N
002831.SZ,002831,裕同科技,深圳,广告包装,深圳市裕同包装科技股份有限公司,"Shenzhen Yuto Packaging Technology Co., Ltd.",ytkj,中小板,SZSE,CNY,L,20161216,,S
002832.SZ,002832,比音勒芬,广东,服饰,比音勒芬服饰股份有限公司,"Biem.L.Fdlkk Garment Co.,Ltd.",bylf,中小板,SZSE,CNY,L,20161223,,S
002833.SZ,002833,弘亚数控,广东,专用机械,广州弘亚数控机械股份有限公司,"Guangzhou Kdt Machinery Co.,Ltd.",hysk,中小板,SZSE,CNY,L,20161228,,S
002835.SZ,002835,同为股份,深圳,元器件,深圳市同为数码科技股份有限公司,"Shenzhen Tvt Digital Technology Co.,Ltd.",twgf,中小板,SZSE,CNY,L,20161228,,N
002836.SZ,002836,新宏泽,广东,广告包装,广东新宏泽包装股份有限公司,"Guangdong New Grand Long Packing Co.,Ltd.",xhz,中小板,SZSE,CNY,L,20161229,,N
002837.SZ,002837,英维克,深圳,专用机械,深圳市英维克科技股份有限公司,"Shenzhen Envicool Technology Co.,Ltd.",ywk,中小板,SZSE,CNY,L,20161229,,S
002838.SZ,002838,道恩股份,山东,塑料,山东道恩高分子材料股份有限公司,"Shandong Dawn Polymer Co.,Ltd.",degf,中小板,SZSE,CNY,L,20170106,,S
002839.SZ,002839,张家港行,江苏,银行,江苏张家港农村商业银行股份有限公司,"Jiangsu Zhangjiagang Rural Commercial Bank Co.,Ltd",zjgh,中小板,SZSE,CNY,L,20170124,,S
002840.SZ,002840,华统股份,浙江,食品,浙江华统肉制品股份有限公司,"Zhejiang Huatong Meat Products Co., Ltd.",htgf,中小板,SZSE,CNY,L,20170110,,N
002841.SZ,002841,视源股份,广东,元器件,广州视源电子科技股份有限公司,Guangzhou Shiyuan Electronic Technology Company Limited,sygf,中小板,SZSE,CNY,L,20170119,,S
002842.SZ,002842,翔鹭钨业,广东,小金属,广东翔鹭钨业股份有限公司,"Guangdong Xianglu Tungsten Co., Ltd.",xlwy,中小板,SZSE,CNY,L,20170119,,N
002843.SZ,002843,泰嘉股份,湖南,钢加工,湖南泰嘉新材料科技股份有限公司,"Bichamp Cutting Technology (Hunan)Co.,Ltd.",tjgf,中小板,SZSE,CNY,L,20170120,,N
002845.SZ,002845,同兴达,深圳,元器件,深圳同兴达科技股份有限公司,"Shenzhen TXD Technology Co.,Ltd.",txd,中小板,SZSE,CNY,L,20170125,,S
